{
  "$schema": "../../schema/platform.schema.json",
  "id": "claude",
  "native_surfaces": [
    "instructions",
    "agents",
    "skills",
    "commands",
    "hooks",
    "mcp",
    "model_routes",
    "permissions"
  ],
  "roots": {
    "project": ".",
    "global": "~/.claude"
  },
  "renderers": [
    "instructions",
    "agents",
    "skills",
    "commands",
    "hooks",
    "settings"
  ]
}
