{
  "$schema": "../../schema/platform.schema.json",
  "id": "codex",
  "native_surfaces": [
    "instructions",
    "agents",
    "skills",
    "hooks",
    "mcp",
    "model_routes"
  ],
  "roots": {
    "project": ".",
    "global": "~/.codex"
  },
  "renderers": [
    "agents-md",
    "agents",
    "skills",
    "hooks",
    "config"
  ]
}
