{
  "$schema": "../../schema/platform.schema.json",
  "id": "opencode",
  "native_surfaces": [
    "instructions",
    "agents",
    "skills",
    "commands",
    "mcp",
    "permissions",
    "model_routes"
  ],
  "roots": {
    "project": ".",
    "global": "~/.config/opencode"
  },
  "renderers": [
    "agents",
    "skills",
    "commands",
    "permissions",
    "mcp",
    "config"
  ]
}
